{
  "version": 1,
  "ball": {
    "type": "baseball",
    "diameter_mm": 73.66
  },
  "pattern": {
    "type": "fibonacci",
    "holes_total": 40,
    "seam_exclusion_deg": 10
  },
  "marking": {
    "access_window_d_mm": 12.7,
    "stencil_dot_d_mm": 7.62,
    "index_type": "double_dot",
    "index_sep_mm": 6.0
  },
  "markers": [
    {
      "id": 0,
      "type": "dot",
      "v": [
        0.2222048604328898,
        0.0,
        0.975
      ]
    },
    {
      "id": 1,
      "type": "dot",
      "v": [
        -0.28017591706462835,
        0.2566640907820851,
        0.925
      ]
    },
    {
      "id": 2,
      "type": "dot",
      "v": [
        0.04232479698236247,
        -0.48226923140544825,
        0.875
      ]
    },
    {
      "id": 3,
      "type": "dot",
      "v": [
        0.3438487131879997,
        0.4484897573400721,
        0.825
      ]
    },
    {
      "id": 4,
      "type": "dot",
      "v": [
        -0.6223007483200726,
        -0.11007624012600395,
        0.775
      ]
    },
    {
      "id": 5,
      "type": "dot",
      "v": [
        0.5811355022285476,
        -0.36967083743456647,
        0.725
      ]
    },
    {
      "id": 6,
      "type": "dot",
      "v": [
        -0.19154065846522825,
        0.7125217022341894,
        0.675
      ]
    },
    {
      "id": 7,
      "type": "dot",
      "v": [
        -0.359795430847844,
        -0.6927642080398022,
        0.625
      ]
    },
    {
      "id": 8,
      "type": "dot",
      "v": [
        0.7685089203559673,
        0.28065822513032745,
        0.575
      ]
    },
    {
      "id": 9,
      "type": "dot",
      "v": [
        -0.7867125609096501,
        0.3247435087988365,
        0.525
      ]
    },
    {
      "id": 10,
      "type": "dot",
      "v": [
        0.37297845505386795,
        -0.7970332942014593,
        0.475
      ]
    },
    {
      "id": 11,
      "type": "dot",
      "v": [
        0.27090976371162223,
        0.86370301604528,
        0.42500000000000004
      ]
    },
    {
      "id": 12,
      "type": "dot",
      "v": [
        -0.8020722580987624,
        -0.46481726816928004,
        0.37500000000000006
      ]
    },
    {
      "id": 13,
      "type": "dot",
      "v": [
        0.9236559681774219,
        -0.20306317354515438,
        0.32499999999999996
      ]
    },
    {
      "id": 14,
      "type": "dot",
      "v": [
        -0.5529548689361936,
        0.786521400166427,
        0.275
      ]
    },
    {
      "id": 15,
      "type": "dot",
      "v": [
        -0.12521551680846232,
        -0.9662795011539828,
        0.22499999999999998
      ]
    },
    {
      "id": 16,
      "type": "dot",
      "v": [
        0.7528492635385057,
        0.6345021563316626,
        0.17500000000000004
      ]
    },
    {
      "id": 23,
      "type": "dot",
      "v": [
        0.216094427874084,
        -0.9605613974347358,
        -0.17500000000000007
      ]
    },
    {
      "id": 24,
      "type": "dot",
      "v": [
        0.48443254256466745,
        0.8453993799999688,
        -0.2250000000000001
      ]
    },
    {
      "id": 25,
      "type": "dot",
      "v": [
        -0.9159609699319676,
        -0.2922165319780679,
        -0.27499999999999997
      ]
    },
    {
      "id": 26,
      "type": "dot",
      "v": [
        0.8585107986030441,
        -0.3966537642352125,
        -0.325
      ]
    },
    {
      "id": 27,
      "type": "dot",
      "v": [
        -0.3578882017213956,
        0.8551555619117645,
        -0.375
      ]
    },
    {
      "id": 28,
      "type": "dot",
      "v": [
        -0.3063647525076204,
        -0.8517720577836212,
        -0.42500000000000004
      ]
    },
    {
      "id": 29,
      "type": "dot",
      "v": [
        0.7789541310997512,
        0.40939646022240056,
        -0.47500000000000014
      ]
    },
    {
      "id": 30,
      "type": "dot",
      "v": [
        -0.8229903244235669,
        0.21693760832366582,
        -0.5249999999999999
      ]
    },
    {
      "id": 31,
      "type": "dot",
      "v": [
        0.44248823913586244,
        -0.688170878653292,
        -0.575
      ]
    },
    {
      "id": 32,
      "type": "dot",
      "v": [
        0.13221923228288263,
        0.7693458745028307,
        -0.625
      ]
    },
    {
      "id": 33,
      "type": "dot",
      "v": [
        -0.5833357947737764,
        -0.4517680273499295,
        -0.675
      ]
    },
    {
      "id": 34,
      "type": "dot",
      "v": [
        0.6863972528664624,
        -0.056866609336005,
        -0.7250000000000001
      ]
    },
    {
      "id": 35,
      "type": "dot",
      "v": [
        -0.42915182108114436,
        0.4639005437189501,
        -0.775
      ]
    },
    {
      "id": 36,
      "type": "dot",
      "v": [
        0.0027568740802178283,
        -0.5651260033349254,
        -0.825
      ]
    },
    {
      "id": 37,
      "type": "dot",
      "v": [
        0.32527500776280804,
        0.3585682212981306,
        -0.875
      ]
    },
    {
      "id": 38,
      "type": "dot",
      "v": [
        -0.3783456704617047,
        -0.03506499169945754,
        -0.925
      ]
    },
    {
      "id": 39,
      "type": "dot",
      "v": [
        0.17699937957933753,
        -0.13433621860291203,
        -0.9750000000000001
      ]
    }
  ],
  "index": {
    "type": "double_dot",
    "ids": [
      0
    ],
    "v1": [
      0.30079926377785104,
      0.0,
      0.9536874765407705
    ],
    "v2": [
      0.1421369491318185,
      0.0,
      0.9898470021632124
    ]
  }
}